<!-- This file is autogenerated by GenDTD based on the 'dtdConfig' file. Do not change this file--> 

<!ELEMENT Table  (#PCDATA)>
<!ELEMENT Tables (Table+)>

<!ELEMENT Sequence  (#PCDATA)>
<!ELEMENT Sequences (Sequence+)>
<!ATTLIST Sequence increment CDATA #IMPLIED>
<!ATTLIST Sequence start CDATA #IMPLIED>

<!ELEMENT CustomerId (#PCDATA)>
<!ATTLIST CustomerId Type CDATA #FIXED "String">

<!ELEMENT CompanyName (#PCDATA)>
<!ATTLIST CompanyName Type CDATA #FIXED "String">

<!ELEMENT CompanyAddress (#PCDATA)>
<!ATTLIST CompanyAddress Type CDATA #FIXED "String">

<!ELEMENT CompanyCity (#PCDATA)>
<!ATTLIST CompanyCity Type CDATA #FIXED "String">

<!ELEMENT CompanyZipCode (#PCDATA)>
<!ATTLIST CompanyZipCode Type CDATA #FIXED "String">

<!ELEMENT ContactpersonName (#PCDATA)>
<!ATTLIST ContactpersonName Type CDATA #FIXED "String">

<!ELEMENT ContactpersonSurname (#PCDATA)>
<!ATTLIST ContactpersonSurname Type CDATA #FIXED "String">

<!ELEMENT ContactpersonPhonenumber (#PCDATA)>
<!ATTLIST ContactpersonPhonenumber Type CDATA #FIXED "String">

<!ELEMENT ContactpersonEmail (#PCDATA)>
<!ATTLIST ContactpersonEmail Type CDATA #FIXED "String">

<!ELEMENT Status (#PCDATA)>
<!ATTLIST Status Type CDATA #FIXED "String">

<!ELEMENT LastUpdateTime (#PCDATA)>
<!ATTLIST LastUpdateTime Type CDATA #FIXED "long">

<!ELEMENT CreationTime (#PCDATA)>
<!ATTLIST CreationTime Type CDATA #FIXED "String">

<!ELEMENT Customer (
    CustomerId,
    CompanyName,
    CompanyAddress,
    CompanyCity,
    CompanyZipCode,
    ContactpersonName,
    ContactpersonSurname,
    ContactpersonPhonenumber,
    ContactpersonEmail,
    Status,
    LastUpdateTime,
    CreationTime,
    ISPARENT__
)>
<!ATTLIST Customer PK CDATA #FIXED "CustomerId">
<!ATTLIST Customer RefName CDATA #FIXED "CustomerId">
<!ATTLIST Customer TableName CDATA #FIXED "crm_customer">

<!ELEMENT ServiceId (#PCDATA)>
<!ATTLIST ServiceId Type CDATA #FIXED "String">

<!ELEMENT PresName (#PCDATA)>
<!ATTLIST PresName Type CDATA #FIXED "String">

<!ELEMENT State (#PCDATA)>
<!ATTLIST State Type (ref|String) "String">

<!ELEMENT SubmitDate (#PCDATA)>
<!ATTLIST SubmitDate Type CDATA #FIXED "String">

<!ELEMENT ModifyDate (#PCDATA)>
<!ATTLIST ModifyDate Type CDATA #FIXED "String">

<!ELEMENT Type (#PCDATA)>
<!ATTLIST Type Type (ref|String) "String">

<!ELEMENT __1__CustomerId (#PCDATA)>
<!ATTLIST __1__CustomerId Type (ref|String) "String">

<!ELEMENT ParentServiceId (#PCDATA)>
<!ATTLIST ParentServiceId Type (ref|String) "String">

<!ELEMENT EndTime (#PCDATA)>
<!ATTLIST EndTime Type CDATA #FIXED "String">

<!ELEMENT NextOperationTime (#PCDATA)>
<!ATTLIST NextOperationTime Type CDATA #FIXED "long">

<!ELEMENT Service (
    ServiceId,
    PresName,
    State,
    SubmitDate,
    ModifyDate,
    Type,
    __1__CustomerId,
    ParentServiceId,
    EndTime,
    NextOperationTime,
    LastUpdateTime,
    ISPARENT__
)>
<!ATTLIST Service PK CDATA #FIXED "ServiceId">
<!ATTLIST Service RefName CDATA #FIXED "ServiceId">
<!ATTLIST Service TableName CDATA #FIXED "crm_service">

<!ELEMENT __1__ServiceId (#PCDATA)>
<!ATTLIST __1__ServiceId Type (ref|String) "String">

<!ELEMENT Attribute (#PCDATA)>
<!ATTLIST Attribute Type CDATA #FIXED "String">

<!ELEMENT Value (#PCDATA)>
<!ATTLIST Value Type CDATA #FIXED "String(4000)">

<!ELEMENT ServiceParameter (
    __1__ServiceId,
    Attribute,
    Value,
    ISPARENT__
)>
<!ATTLIST ServiceParameter PK CDATA #FIXED "__1__ServiceId,Attribute">
<!ATTLIST ServiceParameter RefName CDATA #FIXED "__1__ServiceId,Attribute">
<!ATTLIST ServiceParameter TableName CDATA #FIXED "crm_serviceparam">

<!ELEMENT vpnId (#PCDATA)>
<!ATTLIST vpnId Type (ref|String) "String">

<!ELEMENT siteAttachmentId (#PCDATA)>
<!ATTLIST siteAttachmentId Type (ref|String) "String">

<!ELEMENT ConnectivityType (#PCDATA)>
<!ATTLIST ConnectivityType Type CDATA #FIXED "String">

<!ELEMENT VPNMembership (
    vpnId,
    siteAttachmentId,
    ConnectivityType,
    ISPARENT__
)>
<!ATTLIST VPNMembership PK CDATA #FIXED "vpnId,siteAttachmentId">
<!ATTLIST VPNMembership RefName CDATA #FIXED "vpnId,siteattachmentId">
<!ATTLIST VPNMembership TableName CDATA #FIXED "crm_vpn_membership">

<!ELEMENT ISPARENT__ (#PCDATA)>
<!ATTLIST ISPARENT__ Type CDATA  #FIXED "String"><!ELEMENT ROOT (
  Tables,
  Sequences,
  Customer*,
  Service*,
  ServiceParameter*,
  VPNMembership*
)>
