<?xml version="1.0" encoding="utf-8"?>
<!DOCTYPE ROOT SYSTEM "portal.dtd">
<!--
###############################################################################
#
#  (c) Copyright 2003-2010 Hewlett-Packard Development Company, L.P. 
#
#   
###############################################################################

###############################################################################
#
# $Source: /tmp/vpn/SA_VPN_SP/jboss/server/default/deploy/crmportal.sar/crm.war/WEB-INF/bin/XMLConverter/export.start,v $
# $Revision: 1.8 $
# $Date: 2010-12-14 06:32:30 $
# $Author: shiva $
#
###############################################################################
#
# <Description> 
#
###############################################################################
-->
<ROOT>
  <Tables>
    <Table>crm_customer</Table>
    <Table>crm_service</Table>
    <Table>crm_serviceparam</Table>
    <Table>crm_vpn_membership</Table>
  </Tables>

  <Sequences>
    <Sequence>CRM_CUSTOMER_ID_SEQ</Sequence>
    <Sequence>CRM_MESSAGE_ID_SEQ</Sequence>
    <Sequence>CRM_SERVICE_ID_SEQ</Sequence>
  </Sequences>
  <Customer PK="CustomerId" RefName="CustomerId" TableName="crm_customer">
    <CustomerId    Type="String"></CustomerId>
    <CompanyName    Type="String"></CompanyName>
    <CompanyAddress    Type="String"></CompanyAddress>
    <CompanyCity    Type="String"></CompanyCity>
    <CompanyZipCode    Type="String"></CompanyZipCode>
    <ContactpersonName    Type="String"></ContactpersonName>
    <ContactpersonSurname    Type="String"></ContactpersonSurname>
    <ContactpersonPhonenumber    Type="String"></ContactpersonPhonenumber>
    <ContactpersonEmail    Type="String"></ContactpersonEmail>
    <Status    Type="String"></Status>
    <LastUpdateTime    Type="long"></LastUpdateTime>
    <CreationTime    Type="String"></CreationTime>
    <ISPARENT__    Type="String"></ISPARENT__>
  </Customer>

  <Service PK="ServiceId" RefName="ServiceId" TableName="crm_service">
    <ServiceId    Type="String"></ServiceId>
    <PresName    Type="String"></PresName>
    <State    Type="String"></State>
    <SubmitDate    Type="String"></SubmitDate>
    <ModifyDate    Type="String"></ModifyDate>
    <Type    Type="String"></Type>
    <__1__CustomerId    Type="String"></__1__CustomerId>
    <ParentServiceId    Type="String"></ParentServiceId>
    <EndTime    Type="String"></EndTime>
    <NextOperationTime    Type="long"></NextOperationTime>
    <LastUpdateTime    Type="long"></LastUpdateTime>
    <ISPARENT__    Type="String"></ISPARENT__>
  </Service>

  <ServiceParameter PK="__1__ServiceId,Attribute" RefName="__1__ServiceId,Attribute" TableName="crm_serviceparam">
    <__1__ServiceId    Type="String"></__1__ServiceId>
    <Attribute    Type="String"></Attribute>
    <Value    Type="String(4000)"></Value>
    <ISPARENT__    Type="String"></ISPARENT__>
  </ServiceParameter>

  <VPNMembership PK="vpnId,siteAttachmentId" RefName="vpnId,siteattachmentId" TableName="crm_vpn_membership">
    <vpnId    Type="String"></vpnId>
    <siteAttachmentId    Type="String"></siteAttachmentId>
    <ConnectivityType    Type="String"></ConnectivityType>
    <ISPARENT__    Type="String"></ISPARENT__>
  </VPNMembership>


</ROOT>
